{
  "schemaVersion": 2,
  "knowledgeId": "KL-EXAMPLE-MERGE-001",
  "revision": 1,
  "contentHash": "sha256:1111111111111111111111111111111111111111111111111111111111111111",
  "status": "experimental",
  "kind": "merge-recipe",
  "title": "Example only",
  "merge": {
    "mergeFingerprint": "sha256:2222222222222222222222222222222222222222222222222222222222222222",
    "conflictSet": [
      {
        "modId": "Example.Mod.A",
        "version": "1.0",
        "contentHash": null
      },
      {
        "modId": "Example.Mod.B",
        "version": "2.0",
        "contentHash": null
      }
    ],
    "orderSemantics": {
      "relevant": false,
      "equivalenceReason": "Normalized output is invariant under participant order."
    },
    "conflicts": [
      {
        "asset": "/Game/Example/Asset",
        "property": "ExampleProperty",
        "participants": [
          "Example.Mod.A",
          "Example.Mod.B"
        ],
        "orderRelevant": false
      }
    ],
    "expectedResult": {
      "ExampleProperty": 42
    },
    "outputHash": "sha256:3333333333333333333333333333333333333333333333333333333333333333"
  },
  "applicability": {
    "gameBuildMin": null,
    "gameBuildMax": null,
    "worldScope": "new-world-preferred",
    "requiredMods": [],
    "excludedMods": [],
    "contextNotes": "Unrelated mods do not define merge identity."
  },
  "compatibility": {
    "pmmMin": "1.1.0",
    "pmmMax": null,
    "knowledgeRuntimeMin": 2
  },
  "relationships": {
    "supersedes": [],
    "competesWith": [],
    "derivedFrom": []
  },
  "provenance": {
    "createdUtc": "2026-08-20T16:00:00Z",
    "updatedUtc": "2026-08-20T16:00:00Z",
    "sourceType": "community",
    "sourceReference": null,
    "authorDisplayName": null
  },
  "evidenceSummary": {
    "independentInstallations": 4,
    "positive": 4,
    "negative": 0,
    "inconclusive": 0,
    "newWorldPositive": 2,
    "functionalConfirmed": 1,
    "lastEvaluatedUtc": "2026-08-20T16:30:00Z"
  },
  "safety": {
    "containsExecutablePayload": false,
    "containsGameAssets": false,
    "containsPersonalData": false,
    "reviewNotes": ""
  }
}
